Descriptive,Describing,"Fjermestad, J. & Hiltz, R. S. (2000). Group support systems: A descriptive evaluation of case and field studies. Journal of Management Information Systems, 17(3), 115–159. (Hybrid review: descriptive/ theory testing review)","Fjermestad, J. & Hiltz, R. S. ",2000, Group support systems: A descriptive evaluation of case and field studies,Journal of Management Information Systems,17,3,115,159,(Hybrid review: descriptive/ theory testing review,,http://citeseerx.ist.psu.edu/viewdoc/download?doi=10.1.1.85.3350&rep=rep1&type=pdf,,"This paper presents a descriptive evaluation of 54 case and field studies from 79 published papers spanning two decades of group support systems (GSS) research. It organizes the methodology and results of these studies into a four-factor framework consisting of contextual factors, intervening factors, adaptation factors, and outcome factors. The tables will provide the GSS researcher with a summary of what has been studied. The appendices provide a detailed description of the methodology and the results.",
Descriptive,Describing,"Gable, G. (2010). Strategic information systems research: An archival analysis. The Journal of Strategic Information Systems, 19(1), 3–16.","Gable, G. ",2010, Strategic information systems research: An archival analysis,The Journal of Strategic Information Systems,19,1,3,16,,,http://eprints.qut.edu.au/31545/1/c31545.pdf,,"The Journal of Strategic Information Systems (JSIS) has been an international outlet for Information Systems research that focuses on strategic issues since 1991. This paper reports on an analysis of the research published in JSIS to date. The paper presents a preliminary classification system for research topics related to Strategic Information Systems into which all 316 JSIS research papers as at end 2009 are classified. Discussion on changing emphases in topics over time is provided, in the context of the editorial philosophy of the journal. The paper seeks to stimulate discussion on future directions for research in Strategic Information Systems.",
Descriptive,Describing,"Galliers, R. D., & Whitley, E. A. (2007). Vive les differences? Developing a profile of European information systems research as a basis for international comparisons. European Journal of Information Systems, 16(1), 20–35.","Galliers, R. D., & Whitley, E. A. ",2007, Vive les differences? Developing a profile of European information systems research as a basis for international comparisons,European Journal of Information Systems,16,1,20,35,,https://orsociety.tandfonline.com/doi/abs/10.1057/palgrave.ejis.3000662#.XfSe7abLcTs,,,"The information systems (IS) community is truly international, yet there is often a sense that different elements of the community have different profiles in terms of their research and publication expectations. This paper contributes to this discussion by developing a profile of European IS research that can be used as a basis for international comparisons. It reflects on European research on IS as presented during the first 10 years of the European Conference on Information Systems (ECIS). Based on an analysis of all papers published in the ECIS proceedings during the period 1993–2002, the paper presents the key characteristics of the ECIS conferences, together with a profile of European IS research activity as presented at ECIS. In particular, it highlights the key references and sources used by researchers presenting papers at ECIS. It articulates the research areas presented at ECIS and explores the claim that European IS draws more on social theories than elsewhere. Its contribution in presenting a profile of European research in the IS field lies in identifying particular characteristics of the European style of research that can be compared to that undertaken in other parts of the world.",
Descriptive,Describing,"Li, L., Gao, P., & Mao, J. Y. (2014). Research on IT in China: A call for greater contextualization. Journal of Information Technology, 29(3), 208–222.","Li, L., Gao, P., & Mao, J. Y. ",2014, Research on IT in China: A call for greater contextualization,Journal of Information Technology,29,3,208,222,,https://link.springer.com/article/10.1057/jit.2014.15,,,"Research on information technologies (IT) in China has gained increasing attention in the international information systems (IS) community. This study systematically reviews papers on IT in China published in the ‘Senior Scholars’ Basket of Journals’ from 2000 to 2013. We have two specific objectives: to identify key research issues and trends, and to propose future directions for research on IT in China. This paper categorizes the global distribution of authors and their research methods. Five research streams are identified, including human behaviors in IS adoption and use, IS management, e-Business, social media, digital collaborations and group support, and industry and societal issues in IS. While each stream is examined in detail, we specifically pay attention to the effect of the Chinese context in each paper and the approaches to contextualizing the research. On the basis of our findings from the literature review, we propose a focus on the Chinese context as guidance for future research. ",
Descriptive,Describing,"Matavire, R., & Brown, I. (2013). Profiling grounded theory approaches in information systems research. European Journal of Information Systems, 22(1), 119–129. ","Matavire, R., & Brown, I. ",2013, Profiling grounded theory approaches in information systems research,European Journal of Information Systems,22,1,119,129,,https://orsociety.tandfonline.com/doi/abs/10.1057/ejis.2011.35#.XfSfWabLcTs,,,"Studies claiming to use the Grounded theory methodology (GTM) have been quite prevalent in information systems (IS) literature. A cursory review of this literature reveals conflict in the understanding of GTM, with a variety of grounded theory approaches apparent. The purpose of this investigation was to establish what alternative grounded theory approaches have been employed in IS, and to what extent each has been used. In order to accomplish this goal, a comprehensive set of IS articles that claimed to have followed a grounded theory approach were reviewed. The articles chosen were those published in the widely acknowledged top eight IS-centric journals, since these journals most closely represent exemplar IS research. Articles for the period 1985-2008 were examined. The analysis revealed four main grounded theory approaches in use, namely (1) the classic grounded theory approach, (2) the evolved grounded theory approach, (3) the use of the grounded theory approach as part of a mixed methodology, and (4) the application of grounded theory techniques, typically for data analysis purposes. The latter has been the most common approach in IS research. The classic approach was the least often employed, with many studies opting for an evolved or mixed method approach. These and other findings are discussed and implications drawn.
",
Descriptive,Describing,"Paré, G., Bourdeau, S., Marsan, J., Nach, H., & Shuraida, S. (2008). Re-examining the causal structure of information technology impact research. European Journal of Information Systems, 17(4), 403–416. ","Paré, G., Bourdeau, S., Marsan, J., Nach, H., & Shuraida, S. ",2008, Re-examining the causal structure of information technology impact research,European Journal of Information Systems,17,4,403,416,,,https://s3.amazonaws.com/academia.edu.documents/48577105/ejis.2008.3420160904-19175-1y9wzop.pdf?response-content-disposition=inline%3B%20filename%3DRe-examining_the_causal_structure_of_inf.pdf&X-Amz-Algorithm=AWS4-HMAC-SHA256&X-Amz-Credential=AKIAIWOWYYGZ2Y53UL3A%2F20191214%2Fus-east-1%2Fs3%2Faws4_request&X-Amz-Date=20191214T083931Z&X-Amz-Expires=3600&X-Amz-SignedHeaders=host&X-Amz-Signature=98c9323530d3bfe762308e47861de24596fd0ff0f387228dde42fdc6136efded,,"About 20 years ago, Markus and Robey noted that most research on IT impacts had been guided by deterministic perspectives and had neglected to use an emergent perspective, which could account for contradictory findings. They further observed that most research in this area had been carried out using variance theories at the expense of process theories. Finally, they suggested that more emphasis on multilevel theory building would likely improve empirical reliability. In this paper, we reiterate the observations and suggestions made by Markus and Robey on the causal structure of IT impact theories and carry out an analysis of empirical research published in four major IS journals, Management Information Systems Quarterly (MISQ), Information Systems Research (ISR), the European Journal of Information Systems (EJIS), and Information and Organization (I&O), to assess compliance with those recommendations. Our final sample consisted of 161 theory-driven articles, accounting for approximately 21% of all the empirical articles published in these journals. Our results first reveal that 91% of the studies in MISQ, ISR, and EJIS focused on deterministic theories, while 63% of those in I&O adopted an emergent perspective. Furthermore, 91% of the articles in MISQ, ISR, and EJIS adopted a variance model; this compares with 71% from I&O that applied a process model. Lastly, mixed levels of analysis were found in 14% of all the surveyed articles. Implications of these findings for future research are discussed.",
Descriptive,Describing,"Polites, G. L., Roberts, N., & Thatcher, J. (2012). Conceptualizing models using multidimensional constructs: A review and guidelines for their use. European Journal of Information Systems, 21(1), 22–48. (Hybrid review: descriptive/narrative). ","Polites, G. L., Roberts, N., & Thatcher, J. ",2012, Conceptualizing models using multidimensional constructs: A review and guidelines for their use,European Journal of Information Systems,21,1,22,48,(Hybrid review: descriptive/narrative,,https://www.researchgate.net/profile/Jason_Thatcher2/publication/259527092_Conceptualizing_Models_Using_Multidimensional_Constructs_A_Review_and_Guidelines_for_Their_Use/links/5b54603e45851507a7bcd378/Conceptualizing-Models-Using-Multidimensional-Constructs-A-Review-and-Guidelines-for-Their-Use.pdf,,"While information on multidimensional constructs and empirical methods has become more accessible, there remain substantial challenges to theorizing about their form and implications. There are at least two ostensible reasons for such difficulties. First is the issue of terminology; many different terms are currently used to represent the same structural concept, and there is no evidence of standardization taking place around a single set of terms. Second, many studies do not clearly explain the theoretical reasons for choosing the specific multidimensional form of their constructs. To address these deficiencies, we use concepts from the research methods literature, and illustrations from the information systems (IS) literature, to review definitions and issues related to conceptualizing and operationalizing structural models that include multidimensional constructs. Such advice is necessary if we are going to develop and test increasingly sophisticated theoretical models in IS research. We also offer guidelines about how to conceptualize specific forms of multidimensional constructs. By lending greater conceptual clarity to the literature, we believe that this paper provides a foundation for future research incorporating multidimensional constructs in empirical analysis.",
Descriptive,Describing,"Raub, S., & Rüling, C. C. (2001). The knowledge management tussle – speech communities and rhetorical strategies in the development of knowledge management. Journal of Information Technology, 16(2), 113–130. ","Raub, S., & Rüling, C. C. ",2001, The knowledge management tussle – speech communities and rhetorical strategies in the development of knowledge management,Journal of Information Technology,16,2,113,130,,,https://www.researchgate.net/profile/Steffen_Raub/publication/297473945_The_knowledge_management_tussle_-_speech_communities_and_rhetorical_strategies_in_the_development_of_knowledge_management/links/56e6cc4808aedb4cc8af8878/The-knowledge-management-tussle-speech-communities-and-rhetorical-strategies-in-the-development-of-knowledge-management.pdf,,"Knowledge management has become a major trend since the mid-1990s. Different professional communities, among them information systems/information technology (IS/IT) and more business management-oriented actors, have created strong conceptual ties with the idea of managing knowledge. This paper studies the structure and development of the knowledge management discourse over an 18-year period with an emphasis on the role of the IS/IT community in shaping this discourse. In order to do so, a content analysis of 434 article abstracts from the ABI/Inform database referring to ‘knowledge management’ was performed. The argument here is based on a theoretical framework derived from recent theorizing about popular management knowledge as fashion and it is assumed that different professional or ‘speech communities’ gathering around a concept such as knowledge management enter into competition for limited organizational resources. The paper's findings show the co-existence of two distinct speech communities involved in the knowledge management debate, focusing on either IS/IT or general management issues and they support the idea that both communities engage in a joint effort at sustaining knowledge management as a fashion field. ",
Descriptive,Describing,"Vessey, I., & V Ramesh, R. L. (2002). Research in information systems: An empirical study of diversity in the discipline and its journals. Journal of Management Information Systems, 19(2), 129–174.","Vessey, I., & V Ramesh, R. L. ",2002, Research in information systems: An empirical study of diversity in the discipline and its journals,Journal of Management Information Systems,19,2,129,174,,,https://www.researchgate.net/profile/Iris_Vessey2/publication/220591222_Research_in_Information_Systems_An_Empirical_Study_of_Diversity_in_the_Discipline_and_Its_Journals/links/5552c63d08ae6fd2d81d5f43.pdf,,"Throughout its history, the information systems (IS) discipline has engaged in extensive self-examination, particularly with regard to its apparent diversity. Our overall objective in this study is to better understand the diversity in IS research, and the extent to which diversity is universal across journals that publish IS research. We developed a classification system that comprises five key characteristics of diversity (reference discipline, level of analysis, topic, research approach, and research method) based on a review of prior literature. We then examined articles over a five-year period, from 1995 to 1999, in five journals acknowledged as the top journals of the field, at least in NorthAmerica.Analyses reveal considerable diversity in each of the key characteristics. Perhaps not surprisingly, the research approach used is more focused with most studies being conducted using hypothetico-deductive approaches, whereas reference discipline is perhaps the most diverse of the characteristics examined. An interesting finding is that IS itself emerged as a key reference discipline in the late 1990s. The Journal of Management Information Systems and Information Systems Research publish articles displaying the greatest diversity, and MIS Quarterly and Decision Sciences publish articles that focus on subsets of the field. Our research provides a foundation for addressing the direction that diversity in the IS discipline takes over time. In the shorter term, researchers can use our classification system as a guide to writing abstracts and selecting key words, and the findings of our journal analyses to determine the best outlet for their type of research.",
Descriptive,Describing,"Weerakkody, V., Dwivedi, Y. K., & Irani, Z. (2009). The diffusion and use of institutional theory: A cross-disciplinary longitudinal literature survey. Journal of Information Technology, 24(4), 354–368. ","Weerakkody, V., Dwivedi, Y. K., & Irani, Z. ",2009, The diffusion and use of institutional theory: A cross-disciplinary longitudinal literature survey,Journal of Information Technology,24,4,354,368,,,https://s3.amazonaws.com/academia.edu.documents/45415488/The_diffusion_and_use_of_institutional_t20160506-31564-1nfwgjt.pdf?response-content-disposition=inline%3B%20filename%3DThe_diffusion_and_use_of_institutional_t.pdf&X-Amz-Algorithm=AWS4-HMAC-SHA256&X-Amz-Credential=AKIAIWOWYYGZ2Y53UL3A%2F20191214%2Fus-east-1%2Fs3%2Faws4_request&X-Amz-Date=20191214T084348Z&X-Amz-Expires=3600&X-Amz-SignedHeaders=host&X-Amz-Signature=93f313b82aa74e8d8577ebbcfd539fd404d1b8f3048dac0a5a0dc55c15de8ae7,,"There is a plethora of theories to explore the disciplines of business, management and sociology, with institutional theory being widely used to explore a range of research challenges. In the area of Information Systems (IS), the use of institutional theory remains in its infancy, with much potential for adoption. Much of the rationale underpinning the proposed research is that a systematic review and synthesis of the normative literature may support the direction of further research and the use of institutional theory in exploring pertinent research challenges facing the IS community. This study also serves to signpost cross-disciplinary research, and thus opens up a whole new research paradigm. Therefore, this article seeks to provide a bibliometric analysis and a comprehensive and systematic review of the literature pertaining to institutional theory to ascertain the current ‘state of play’ of the theory. Information on a series of variables was extracted after conducting a review of 511 articles across various disciplines that have utilised institutional theory, published in 210 peer-reviewed journals between 1978 and 2008. The findings suggest that the positivist paradigm, empirical and quantitative research, the survey method and organisation/firm as a unit of analysis was used predominantly in combination with institutional theory. The results of this study may have implications for researchers, journal editors, reviewers and universities.",
Descriptive,Describing,"Williams, M. D., Dwivedi, Y. K., Lal, B., & Schwarz, A. (2009). Contemporary trends and issues in IT adoption and diffusion research. Journal of Information Technology, 24(1), 1–10. ","Williams, M. D., Dwivedi, Y. K., Lal, B., & Schwarz, A. ",2009, Contemporary trends and issues in IT adoption and diffusion research,Journal of Information Technology,24,1,1,10,,,https://s3.amazonaws.com/academia.edu.documents/57399127/Articulo_1.pdf?response-content-disposition=inline%3B%20filename%3DContemporary_trends_and_issues_in_IT_ado.pdf&X-Amz-Algorithm=AWS4-HMAC-SHA256&X-Amz-Credential=AKIAIWOWYYGZ2Y53UL3A%2F20191214%2Fus-east-1%2Fs3%2Faws4_request&X-Amz-Date=20191214T084443Z&X-Amz-Expires=3600&X-Amz-SignedHeaders=host&X-Amz-Signature=c86ba00f186b25f02f666e5c8609049cf9d00477e8f34ef99265e3ab88032c5e,,"The high level of investigative activity to date into information systems and information technology acceptance and diffusion has witnessed the use of a wide range of exploratory techniques, examining many different systems and technologies in countless different contexts and geographical locations. The aim of this paper is to provide a comprehensive and systematic review of the literature pertaining to such adoption and diffusion issues in order to observe trends, ascertain the current ‘state of play’, and to highlight promising lines of inquiry including those lacking investigative activity or simply being in need of renewed interest. Previous research activity was analysed along a number dimensions including units of analysis, research paradigms, methodologies, and methods, theories and theoretical constructs, and technologies/contexts examined. Information on these and other variables was extracted during an examination of 345 papers on innovation adoption, acceptance and diffusion appearing in 19 peer-reviewed journals between 1985 and 2007. Findings suggest that the positivist paradigm, empirical and quantitative research, the survey method and Technology Acceptance Model theory (and its associated constructs) were predominantly used in the body of work examined, revealing clear opportunities for researchers to make original contributions by making greater use of the theoretical and methodological variety available to them, and consequently reducing the risk of research in the area moving toward overall homogeneity. ",
Descriptive,Describing,"Zhang, P., & Li, N. L. (2005). The intellectual development of human-computer interaction research: A critical assessment of the MIS literature (1990–2002). Journal of the Association for information Systems, 6(11), 227–292. ","Zhang, P., & Li, N. L. ",2005, The intellectual development of human-computer interaction research: A critical assessment of the MIS literature (1990–2002),. Journal of the Association for information Systems,6,11,227,292,,,http://130.18.86.27/faculty/warkentin/SecurityPapers/Merrill/ZhangLi2005_JAIS6_11_HCILiteratureAssessment1990-2002.pdf,,"As one of the five research streams of the Management Information Systems (MIS) discipline, Human-Computer Interaction (HCI) was predicted to resurge in the post-millennium era. To date, however, few studies have either synthesized existing studies or drawn an overarching picture of this sub-discipline. This study delineates the intellectual development of HCI research in MIS by a multifaceted assessment of the published HCI articles over a period of 13 years (1990-2002) in seven prime MIS journals: MISQ, ISR, JMIS, Decision Sciences, Management Science, DATA BASE, and JAIS. Twenty-two specific questions are addressed to answer the following five general research questions about the HCI sub-discipline: (1) What constitutes its intellectual substance? (2) What relationships does it have with other disciplines? (3) What are its recent evolutions? (4) What are the patterns of publishing HCI studies in the primary MIS journals? And, (5) Who are its contributing members? We use classification approach to address these questions. Descriptive analyses, including co-occurrence and cross-facet analyses, depict the key relationships. Trend analyses demonstrate recent evolutions. We present number of areas for future research, along with a discussion of potential future directions for the sub-discipline. This study should be of interest to researchers in this sub-discipline, in the MIS discipline, and in other related disciplines for future research, collaboration, publication, and education. It should also be of interest to doctoral students to identify potential research topics for dissertation research and to identify academic institutions for future employment where such research is understood, appreciated, and encouraged.",
Meta-analysis,Theory testing,"Dennis, A. R., & Wixom, B. H. (2002). Investigating the moderators of the group support systems use with meta-analysis. Journal of Management Information Systems, 18(3), 235–257. ","Dennis, A. R., & Wixom, B. H. ",2002, Investigating the moderators of the group support systems use with meta-analysis,Journal of Management Information Systems,18,3,235,257,,https://www.tandfonline.com/doi/abs/10.1080/07421222.2002.11045696,,211,"This paper presents a meta-analysis that investigates five moderators (task, tool, the type of group, the size of the group, and facilitation) and their influences on the overall effects of group support systems (GSS). Results show that process satisfaction is higher for idea-generation tasks than for decision-making tasks. The GSS tool (that is, the use of level 1 or level 2 GSS) influences decision quality. Level 1 tools support the exchange of information, whereas, level 2 tools are designed to aid in decision-making. Decision quality is higher when using level 2 tools, however, there is no difference in the number of ideas generated when using level 1 or level 2 tools. Decision quality is lower for virtual teams, but there is no difference in the number of ideas generated between virtual teams and face-to-face teams using GSS. Group size is an important moderator when measuring decision time and satisfaction with process. The former is shorter for larger groups, and the latter is higher for larger groups. Process facilitation leads to higher decision quality and higher satisfaction with the process. These results illustrate the importance of examining the moderators of GSS use and the viability of conducting a meta-analysis to investigate a large body of research with seemingly conflicting or equivocal results.",
