Theoretical,Explaining,"Kauffman, R. J., & Lee, D. (2010). A multi-level theory approach to understanding price rigidity in Internet retailing. Journal of the Association for Information Systems, 11(6), 303–338.","Kauffman, R. J., & Lee, D. ",2010, A multi-level theory approach to understanding price rigidity in Internet retailing,Journal of the Association for Information Systems,11,6,303,338,,https://aisel.aisnet.org/jais/vol11/iss6/2/,https://aisel.aisnet.org/cgi/viewcontent.cgi?article=1540&context=jais,,"Price rigidity involves prices that do not change with the regularity predicted by standard economic theory, and is of long-standing interest to firms and industries, and our understanding of the economy as a whole. The previous IS literature has failed to identify the central role of IT and Internet retailing-related technologies to explain the rigidity of prices on the Internet. Instead, it has offered only limited explanations, such as menu costs and tacit collusion. These ideas, and quite a few other key theoretical perspectives were formulated in disciplines other than ours. Thus, the issue of price rigidity and price adjustment in Internet retailing should be given more scrutiny than the literature has provided to date. We review and synthesize what we know about price rigidity in non-electronic retailing contexts using a multi-level theory approach that identifies three unique levels of analysis: the firm-specific level, the firm-to-consumer level, and the firm-to-market level. We evaluate to what extent this knowledge is applicable to explain price-setting and price adjustment on the Internet. We conclude that there should not be less price rigidity in Internet retailing than in traditional retailing – even though the Internet is involved. To this end, we recommend a multi-level variance theory of Internet-based price rigidity. This study provides a foundation for the development of new theoretical perspectives at the crossroads of the academic disciplines of marketing, economics and IS. It encourages research that is able to probe for a deeper understanding of new economic phenomena associated with the digital economy’s growth.","Economic   analysis,   information   systems,   information   technology,   interfirm   competition,   Internet   retailing, multi-level theory, price rigidity, pricing strategy, variance theory."
Theoretical,Explaining,"Leidner, D. E. (2010). Globalization, culture, and information: Towards global knowledge transparency. The Journal of Strategic Information Systems, 19(2), 69–77.","Leidner, D. E. ",2010," Globalization, culture, and information: Towards global knowledge transparency",The Journal of Strategic Information Systems,19,2,69,77,,https://www.sciencedirect.com/science/article/abs/pii/S0963868710000089,,137,"In this paper, I seek to intertwine the IS research on globalization with IS research on culture. I first discuss various perspectives of globalization – cultural imperialism, interconnected businesses, and a global village – and the accompanying role of information technologies. I then present a brief overview of three waves of IS culture research: identifying differences, explaining differences, managing differences. Based upon the gaps identified in the overview, I suggest some propositions for future IS culture research. Finally, I seek to identify important future research that lies at the intersection of globalization and culture research, namely research into global knowledge transparency. Global knowledge transparency involves the dual objectives of providing more detailed product and service information to the consumer and gathering more detailed knowledge about the individual. The former helps individuals make more responsible choices in their purchase decisions, enabling them to understand the consequences of their choices on the well-being of others. The latter helps individuals make more informed decisions concerning their own well-being, enabling them to better understand the consequences of their choices for their own life and health. Taken together, the two objectives of global knowledge transparency can help societies promote better use of resources and more individual accountability.",Globalization Culture Information transparency
Theoretical,Explaining,"Leidner, D. E., & Kayworth, T. (2006). Review: a review of culture in information systems research: Toward a theory of information technology culture conflict. MIS Quarterly, 30(2), 357–399.","Leidner, D. E., & Kayworth, T. ",2006, Review: a review of culture in information systems research: Toward a theory of information technology culture conflict,MIS Quarterly,30,2,357,399,,https://aisel.aisnet.org/misq/vol30/iss2/9/,http://citeseerx.ist.psu.edu/viewdoc/download?doi=10.1.1.870.4816&rep=rep1&type=pdf,1653,"An understanding of culture is important to the study of information technologies in that culture at various levels, including national, organizational, and group, can influence the successful implementation and use of information technology. Culture also plays a role in managerial processes that may directly, or indirectly, influence IT. Culture is a challenging variable to research, in part because of the multiple divergent definitions and measures of culture. Notwithstanding, a wide body of literature has emerged that sheds light on the relationship of IT and culture. This paper sets out to provide a review of this literature in order to lend insights into our understanding of the linkages between IT and culture. We begin by conceptualizing culture and laying the groundwork for a values-based approach to the examination of IT and culture. Using this approach, we then provide a comprehensive review of the organizational and cross-cultural IT literature that conceptually links these two traditionally separate streams of research. From our analysis, we develop six themes of IT culture research emphasizing culture’s impact on IT, IT’s impact on culture, and IT culture. Building upon these themes, we then develop a theory of IT, values, and conflict. Based upon the theory, we develop propositions concerning three types of cultural conflict and the results of these conflicts. Ultimately, the theory suggests that the reconciliation of these conflicts results in a reorientation of values. We conclude with the particular research challenges posed in this line of inquiry","National culture, organizational culture,  infor-mation systems, IT values"
Theoretical,Explaining,"Li, Y., & Kettinger, W. J. (2006). An evolutionary information-processing theory of knowledge creation. Journal of the Association for Information Systems, 7(9), 593–617.","Li, Y., & Kettinger, W. J. ",2006, An evolutionary information-processing theory of knowledge creation,Journal of the Association for Information Systems,7,9,593,617,,https://aisel.aisnet.org/jais/vol7/iss9/25/,https://pdfs.semanticscholar.org/734e/f89033fd1c0a8bbd9ff355d5d2b5f4147a7e.pdf,34,"Past Information Systems (IS) research on knowledge creation has not adequately accounted for the evolutionary nature of knowledge. Research limitations also exist in depicting the roles of information in the knowledge creation process. These two problems present difficulties for practitioners when attempting to successfully implement Information Technology (IT) to facilitate knowledge creation. Based on a problem-solving paradigm, this research analyzes knowledge creation from both the evolutionary and information-processing perspectives. The resultant theory outlines a process whereby tentative knowledge is generated from varied existing knowledge and applied to a problem, producing information to test the extent to which the problem can be solved. An iterative process continues until the tentative knowledge with the highest potential to solve the problem is found, yielding the information to best meet the goal. This process is further embedded in an organization-wide problem-solving hierarchy where new knowledge is developed via the integration of knowledge elements of sub-problems. By incorporating the evolutionary nature of knowledge, this research provides a deeper understanding of the knowledge creation process and the key determinants of its success. More importantly, by clearly specifying the roles of information in the process, it offers promise in the better design of IT to improve knowledge creation performance. We develop a framework based on this Evolutionary Information-Processing Theory to aid practitioners in IS design."," knowledge  creation,  information  processing,  problem  solving,  evolutionary  epistemology, and organizational memory "
Theoretical,Explaining,"Mathiassen, L., Saarinen, T., Tuunanen, T., & Rossi, M. (2007). A contingency model for requirements development. Journal of the Association for Information Systems, 8(11), 569–597.","Mathiassen, L., Saarinen, T., Tuunanen, T., & Rossi, M. ",2007, A contingency model for requirements development,Journal of the Association for Information Systems,8,11,569,597,,https://aisel.aisnet.org/jais/vol8/iss11/33/,http://citeseerx.ist.psu.edu/viewdoc/download?doi=10.1.1.1025.5756&rep=rep1&type=pdf,148,"Drawing upon the requirements and software development literature, the present study proposes an integrative contingency model for requirements development. Based on 116 quality journal articles, we analyze requirements development risks, requirements development techniques, and heuristics for how they are effectively related. Subsequently, we synthesize the insights from the identified literature into a model for requirements development that relates patterns of risk resolution to archetypical risk profiles. The model integrates the literature on requirements and software development; sets the scene for future research; and, finally, proposes how practitioners can manage risks in requirements development projects.",Requirements development; contingency theory; risk management.
Theoretical,Explaining,"Melville, N., Kraemer, K., & Gurbaxani, V. (2004). Review: Information technology and organizational performance: An integrative model of IT business value. MIS Quarterly, 28(2), 283–322.","Melville, N., Kraemer, K., & Gurbaxani, V. ",2004, Review: Information technology and organizational performance: An integrative model of IT business value,MIS Quarterly,28,2,283,322,,https://misq.org/catalog/product/view/id/300,,3742,"Despite the importance to researchers, managers, and policy makers of how information technology (IT) contributes to organizational performance, there is uncertainty and debate about what we know and don't know. A review of the literature reveals that studies examining the association between information technology and organizational performance are divergent in how they conceptualize key constructs and their interrelationships. We develop a model of IT business value based on the resource-based view of the firm that integrates the various strands of research into a single framework. We apply the integrative model to synthesize what is known about IT business value and guide future research by developing propositions and suggesting a research agenda. A principal finding is that IT is valuable, but the extent and dimensions are dependent upon internal and external factors, including complementary organizational resources of the firm and its trading partners, as well as the competitive and macro environment. Our analysis provides a blueprint to guide future research and facilitate knowledge accumulation and creation concerning the organizational performance impacts of information technology.","Business value, competitive advantage, cost reduction, country characteristics, economic impacts, efficiency, industry characteristics, information technology, IT business value, IT payoff, macro environment, performance, productivity, resource-based view"
Theoretical,Explaining,"Miranda, S. M., & Kavan, C. B. (2005). Moments of governance in IS outsourcing: Conceptualizing effects of contracts on value capture and creation. Journal of Information Technology, 20(3), 152–169.","Miranda, S. M., & Kavan, C. B. ",2005, Moments of governance in IS outsourcing: Conceptualizing effects of contracts on value capture and creation,Journal of Information Technology,20,3,152,169,,https://journals.sagepub.com/doi/abs/10.1057/palgrave.jit.2000045,https://s3.amazonaws.com/academia.edu.documents/5622746/m_k05.pdf?response-content-disposition=inline%3B%20filename%3DMoments_of_Governance_In_IS_Outsourcing.pdf&X-Amz-Algorithm=AWS4-HMAC-SHA256&X-Amz-Credential=AKIAIWOWYYGZ2Y53UL3A%2F20191215%2Fus-east-1%2Fs3%2Faws4_request&X-Amz-Date=20191215T151350Z&X-Amz-Expires=3600&X-Amz-SignedHeaders=host&X-Amz-Signature=f7444ba72c114bcb0e06165da9c6f8ba9f1d1659197080ef1fd0d9d718d97937,120,"Research on the governance of IS outsourcing has recognized two moments of governance: the formal outsourcing contract (promissory contract) and post-contractual relationship management (psychological contract). While this research has been prescriptive of contract terms that lead to successful outsourcing, there is need for clarity on what specific governance options are available at each moment of governance and how governance choices at one moment affect those at another, and consequently affect outsourcing outcomes. This paper draws on theoretical and empirical work in the areas of governance and contracts to develop a model of IS outsourcing governance, delineating specific moments of governance (MoG). It describes how the IS outsourcing context circumscribes market, hierarchy, and network governance options that are available at the promissory contract and psychological contract moments. Processes and structures that constitute governance choices at each moment of governance are identified. This analysis of outcomes recognizes an inherent tension in interorganizational relationships: firms’ desire for value capture or efficiency vs their desire for value creation or innovation. We explore how choices in formulating the promissory contract affect the psychological contract, and how psychological contract choices impact value capture and creation. The paper concludes by exploring the implications of the MoG model for practitioners and suggesting areas in which further conceptualization and empirical work may be beneficial.","inter-organizational systems, outsourcing, contract, social capital, organizational governance"
Theoretical,Explaining,"Nazir, S., & Pinsonneault, A. (2012). IT and firm agility: An electronic integration perspective. Journal of the Association for Information Systems, 13(3), 150–171.","Nazir, S., & Pinsonneault, A. ",2012, IT and firm agility: An electronic integration perspective,Journal of the Association for Information Systems,13,3,150,171,,https://aisel.aisnet.org/jais/vol13/iss3/2/,http://citeseerx.ist.psu.edu/viewdoc/download?doi=10.1.1.232.69&rep=rep1&type=pdf,94,"Firms evolving in increasingly turbulent environments need to respond to market threats and opportunities with speed. At the same time, firms implement numerous information technologies (IT) in the hope of streamlining processes and providing managers with unfettered access to information from both within and outside the firm. While research shows how agility and IT contribute to firm performance, the relationship between these two constructs remains relatively unexplored. Using an electronic integration perspective, we develop a framework that addresses this issue. The framework suggests that IT applications affect the two components of agility (sensing and responding) through two types of integration (internal and external). The framework also explains the mediating roles of knowledge exploration, knowledge exploitation, and process coupling. Four propositions are developed and illustrated with different examples. Avenues for future research are developed."," Electronic Integration, Firm Agility, Knowledge Exploitation, Knowledge Exploration, Process Coupling, Sensing, Responding"
Theoretical,Explaining,"Nevo, S., & Wade, M. R. (2010). The formation and value of IT-enabled resources: Antecedents and consequences of synergistic relationships. MIS Quarterly, 34(1), 163–183.","Nevo, S., & Wade, M. R. ",2010, The formation and value of IT-enabled resources: Antecedents and consequences of synergistic relationships,MIS Quarterly,34,1,163,183,,https://aisel.aisnet.org/misq/vol34/iss1/10/,https://www.researchgate.net/profile/Michael_Wade6/publication/220259882_The_Formation_and_Value_of_IT-Enabled_Resources_Antecedents_and_Consequences_of_Synergistic_Relationships/links/563b5c7d08aec6f17dd4c6fa.pdf,506,"This paper informs the literature on the business value of information technology by conceptualizing a path from IT assets—that is, commodity-like or off-the-shelf information technologies—to sustainable competitive advantage. This path suggests that IT assets can play a strategic role when they are combined with organizational resources to create IT-enabled resources. To the extent that relationships between IT assets and organizational resources are synergistic, the ensuing IT-enabled resources are capable of positively affecting firms’ sustainable competitive advantage via their improved strategic potential. This is an important contribution since IT-related organizational benefits have been hard to demonstrate despite attempts to study them through a variety of methods and theoretical lenses. This paper synthesizes systems theory and the resource-based view of the firm to build a unified conceptual model linking IT assets with firm-level benefits. Several propositions are derived from the model and their implications for IS research and practice are discussed.
","Business value of IT, systems theory, resource-based view of the firm, IT-enabled resources, emergent capa-bilities, synergy, strategic potential, compatibility, integrationeffor"
Theoretical,Explaining,"Orlikowski, W. J., & Iacono, C. S. (2001). Research commentary: Desperately seeking the “IT” in IT research – A call to theorizing the IT artifact. Information Systems Research, 12(2), 121–134.","Orlikowski, W. J., & Iacono, C. S. ",2001, Research commentary: Desperately seeking the “IT” in IT research – A call to theorizing the IT artifact,Information Systems Research,12,2,121,134,,https://pubsonline.informs.org/doi/abs/10.1287/isre.12.2.121.9700,http://130.18.86.27/faculty/warkentin/secure/9213/articles/OrlikowskiIacono2001.pdf,2816,"The field of information systems is premised on the centrality of information technology in everyday socio-economic life. Yet, drawing on a review of the full set of articles published in Information Systems Research (ISR) over the past ten years, we argue that the field has not deeply engaged its core subject matter—the information technology (IT) artifact. Instead, we find that IS researchers tend to give central theoretical significance to the context (within which some usually unspecified technology is seen to operate), the discrete processing capabilities of the artifact (as separable from its context or use), or the dependent variable (that which is posited to be affected or changed as technology is developed, implemented, and used). The IT artifact itself tends to disappear from view, be taken for granted, or is presumed to be unproblematic once it is built and installed. After discussing the implications of our findings, we propose a research direction for the IS field that begins to take technology as seriously as its effects, context, and capabilities. In particular, we propose that IS researchers begin to theorize specifically about IT artifacts, and then incorporate these theories explicitly into their studies. We believe that such a research direction is critical if IS research is to make a significant contribution to the understanding of a world increasingly suffused with ubiquitous, interdependent, and emergent information technologies.",Information Systems Research; Information Technology; IT Research; IT Theory; Thecnological Artifacts; Technology Change
Theoretical,Explaining,"Petter, S., DeLone, W., & McLean, E. R. (2013). Information systems success: The quest for the independent variables. Journal of Management Information Systems, 29(4), 7–61.","Petter, S., DeLone, W., & McLean, E. R. ",2013, Information systems success: The quest for the independent variables,Journal of Management Information Systems,29,4,7,61,,https://www.tandfonline.com/doi/abs/10.2753/MIS0742-1222290401,,608,"In 1992, DeLone and McLean suggested that the dependent variable for information systems (IS) research is IS Success. Their research resulted in the widely cited DeLone and McLean (D&M) IS Success Model, in which System Quality, Information Quality, Use, User Satisfaction, Individual Impact, and Organizational Impact are distinct, but related dimensions of IS success. Since the original IS Success Model was published, research has developed a better understanding of IS success. Meanwhile, comprehensive and integrative research on the variables that influence IS success has been lacking. Therefore, we examine the literature on the independent variables that affect IS success. After examining over 600 articles, we focused our attention on integrating the findings of over 140 studies. In this research, we identify 43 specific variables posited to influence the different dimensions of IS success, and we organize these success factors into five categories based on the Leavitt Diamond of Organizational Change: task characteristics, user characteristics, social characteristics, project characteristics, and organizational characteristics. Next, we identify 15 success factors that have consistently been found to influence IS success: Enjoyment, Trust, User Expectations, Extrinsic Motivation, IT Infrastructure, Task Compatibility, Task Difficulty, Attitudes Toward Technology, Organizational Role, User Involvement, Relationship with Developers, Domain Expert Knowledge, Management Support, Management Processes, and Organizational Competence. Finally, we highlight gaps in our knowledge of success factors and propose a road map for future research.","independent variables, IS success, research integration, success determinants, success factors"
Theoretical,Explaining,"Piccoli, G., & Ives, B. (2005). Review: IT-dependent strategic initiatives and sustained competitive advantage: A review and synthesis of the literature. MIS Quarterly, 29(4), 747–776.","Piccoli, G., & Ives, B. ",2005, Review: IT-dependent strategic initiatives and sustained competitive advantage: A review and synthesis of the literature,MIS Quarterly,29,4,747,776,,https://www.jstor.org/stable/pdf/25148708.pdf?seq=1,https://s3.amazonaws.com/academia.edu.documents/32991494/A2.pdf?response-content-disposition=inline%3B%20filename%3DPiccoli_and_Ives_IT-Dependent_Strategic.pdf&X-Amz-Algorithm=AWS4-HMAC-SHA256&X-Amz-Credential=AKIAIWOWYYGZ2Y53UL3A%2F20191215%2Fus-east-1%2Fs3%2Faws4_request&X-Amz-Date=20191215T151854Z&X-Amz-Expires=3600&X-Amz-SignedHeaders=host&X-Amz-Signature=f1156c6d2f2ed8621c3212abd3ded4a9f1c0d34350dce5b31de1a660ee58617a,826,"The role of information systems in the creation and appropriation of economic value has a long tradition of research, within which falls the literature on the sustainability of IT-dependent competitive advantage. In this article, we formally define the notion of IT-dependent strategic initiative and use it to frame a review of the literature on the sustain- ability of competitive advantage rooted in information systems use. We offer a framework that articulates both the dynamic approach to IT-dependent strategic advantage currently receiving attention in the literature and the underlying drivers of sustainability. This framework models how and why the characteristics of the IT-dependent strategic initiative enable sustained competitive advantage, and how the determinants of sustainability are developed and strengthened over time. Such explanation facilitates the pre-implementation analysis of planned initiatives by innovators, as well as the post-implementation evaluation of existing initiatives so as to identify the basis of their sustainability.

In carrying out this study, we examined the interdisciplinary literature on strategic information systems. Using a structured methodology, we reviewed the titles and abstracts of 648 articles drawn from information systems, strategic management, and marketing literature. We then examined and individually coded a relevant subset of 117 articles. The literature has identified four barriers to erosion of competitive advantage for IT-dependent strategic initiatives and has surfaced the structural determinants of their magnitude. Previous work has also begun to theorize about the process by which these barriers to erosion evolve over time. Our review reveals that significant exploratory research and theoretical development have occurred in this area, but there is a paucity of research providing rigorous tests of theoretical propositions.

Our work makes three principal contributions. First, it formalizes the definition of IT-dependent strategic initiative. Second, it organizes the extant interdisciplinary research around an integrative framework that should prove useful to both research and practice. This framework offers an explanation of how and why IT-dependent strategic initiatives contribute to sustained competitive advantage, and explains the process by which they evolve over time. Finally, our review and analysis of the literature offers the basis for future research directions.","Strategic information systems, sustainable competitive advantage, competitive advantage, strategic agility, IT-dependent strategic initiatives"
